{
  "$schema": "http://json-schema.org/draft-06/schema#",
  "$ref": "#/definitions/Welcome",
  "definitions": {
    "Welcome": {
      "type": "object",
      "additionalProperties": false,
      "properties": {
        "name": {
          "type": "string"
        },
        "topLevelDomain": {
          "type": "array",
          "items": {
            "type": "string"
          }
        },
        "alpha2Code": {
          "type": "string"
        },
        "alpha3Code": {
          "type": "string"
        },
        "callingCodes": {
          "type": "array",
          "items": {
            "type": "string",
            "format": "integer"
          }
        },
        "capital": {
          "type": "string"
        },
        "altSpellings": {
          "type": "array",
          "items": {
            "type": "string"
          }
        },
        "region": {
          "type": "string"
        },
        "subregion": {
          "type": "string"
        },
        "population": {
          "type": "integer"
        },
        "latlng": {
          "type": "array",
          "items": {
            "type": "integer"
          }
        },
        "demonym": {
          "type": "string"
        },
        "area": {
          "type": "integer"
        },
        "gini": {
          "type": [
            "integer",
            "number"
          ]
        },
        "timezones": {
          "type": "array",
          "items": {
            "type": "string"
          }
        },
        "borders": {
          "type": "array",
          "items": {
            "type": "string"
          }
        },
        "nativeName": {
          "type": "string"
        },
        "numericCode": {
          "type": "string",
          "format": "integer"
        },
        "currencies": {
          "type": "array",
          "items": {
            "$ref": "#/definitions/Currency"
          }
        }
      },
      "required": [
        "alpha2Code",
        "alpha3Code",
        "altSpellings",
        "area",
        "borders",
        "callingCodes",
        "capital",
        "currencies",
        "demonym",
        "gini",
        "latlng",
        "name",
        "nativeName",
        "numericCode",
        "population",
        "region",
        "subregion",
        "timezones",
        "topLevelDomain"
      ],
      "title": "Welcome"
    },
    "Currency": {
      "type": "object",
      "additionalProperties": false,
      "properties": {
        "code": {
          "type": "string"
        },
        "name": {
          "type": "string"
        },
        "symbol": {
          "type": "string"
        }
      },
      "required": [
        "code",
        "name",
        "symbol"
      ],
      "title": "Currency"
    }
  }
}
