{
  "name": "Germany",
  "topLevelDomain": [
    ".de"
  ],
  "alpha2Code": "DE",
  "alpha3Code": "DEU",
  "callingCodes": [
    "49"
  ],
  "capital": "Berlin",
  "altSpellings": [
    "DE",
    "Federal Republic of Germany",
    "Bundesrepublik Deutschland"
  ],
  "region": "Europe",
  "subregion": "Western Europe",
  "population": 81770900,
  "latlng": [
    51,
    9
  ],
  "demonym": "German",
  "area": 357114,
  "gini": 28.3,
  "timezones": [
    "UTC+01:00"
  ],
  "borders": [
    "AUT",
    "BEL",
    "CZE",
    "DNK",
    "FRA",
    "LUX",
    "NLD",
    "POL",
    "CHE"
  ],
  "nativeName": "Deutschland",
  "numericCode": "276",
  "currencies": [
    {
      "code": "EUR",
      "name": "Euro",
      "symbol": "â‚¬"
    }
  ]
}